assessmentId,internalTaxonId,scientificName,redlistCategory,redlistCriteria,yearPublished,assessmentDate,criteriaVersion,language,rationale,habitat,threats,population,populationTrend,range,useTrade,systems,conservationActions,realm,yearLastSeen,possiblyExtinct,possiblyExtinctInTheWild,scopes
11274315,5529,Cricetus cricetus,Not Applicable,,2010,2008-01-01 00:00:00 UTC,3.1,English,This species is listed as Not Applicable as it is only of marginal occurrence in the Mediterranean region.,"Its original habitat was fertile steppe and grassland, but it has successfully spread into a variety of anthropogenic habitats including meadows, croplands (especially cereals), and field edges, road verges and scrubby fallow areas on farms. In eastern parts of its range it is found quite often in gardens and orchards, in close proximity to human habitation. It is more abundant in these man-made habitats than it is in natural grassland. It prefers relatively deep, heavy soils, in which it digs extensive burrows. Its diet mainly consists of the green parts of plants and seeds, supplemented by invertebrates and, occasionally, small vertebrates. At high densities, it can be an agricultural pest (Nechay 2000).","Its decline in western Europe has been attributed to a combination of persecution and agricultural intensification. It was trapped and poisoned to prevent damage to crops, and this practice continues in some parts of the hamster's range (although not in the western part of its range). In eastern Europe it continues to be trapped for the fur trade. Agricultural intensification, specifically the loss of perennial crops and small uncultivated patches of land, the introduction of autumn-sown cereals, and the increased use of pesticides, has had a negative impact on many hamster populations. Changing agricultural practices in eastern Europe, where the hamster population has traditionally been considered stable, may pose a threat in the future.","It has undergone severe range and population declines in western and central Europe, and it now has a highly fragmented distribution in these areas. Subpopulation extinctions have occurred in a number of countries including Belgium, the Netherlands, France and Germany. Less is known about the status of the species in eastern Europe and Russia, but it is certainly more abundant there than in the west. Spring population densities of 0.5-3 individuals per hectare are reported in western Europe (Weinhold 1999), whereas densities of 3.4-37 occupied burrows per hectare have been recorded in Hungary (Nechay 2000). In Ukraine the species is considered abundant (I. Zagorodnyuk pers. comm. 2006). In areas where the species is abundant, periodic population outbreaks occur (Nechay 2000).",Decreasing,"<em>Cricetus cricetus</em> has a large global range, extending from western Europe, through central and eastern Europe, Russia, and Kazakhstan, reaching as far east as the Yenisey river (Asian Russia). In Europe, it occurs from Belgium, the Netherlands and northern France in the west to Russia in the east, and from northern Germany, Poland and Russia in the north to Bulgaria in the south (Panteleyev 1998, Weinhold 1999). It is found from sea level to 650 m (Nechay 2000).",,Terrestrial,"It is listed on Appendix II of the Bern Convention and Annex IV of the EU Habitats and Species Directive. Specific conservation recommendations to improve the status of the species in western Europe are detailed in Stubbe and Stubbe (1998) and Nechay (2000). These focus on subsidising farmers to manage agricultural habitats appropriately, and minimising use of pesticides. In the last few years, reintroductions have been carried out in France, Belgium and the Netherlands. Monitoring is required in eastern range states to determine population trends.",Palearctic,,false,false,Mediterranean
11274553,5529,Cricetus cricetus,Least Concern,,2007,2006-05-21 00:00:00 UTC,3.1,English,"At the European and EU 25 levels the species is considered Least Concern. It has a very wide range and, although population declines are occuring in the western part of the range, it is stable elsewhere (including in a number of EU 25 countries).","Its original habitat was fertile steppe and grassland, but it has successfully spread into a variety of anthropogenic habitats including meadows, croplands (especially cereals), and field edges, road verges and scrubby fallow areas on farms. In eastern parts of its range it is found quite often in gardens and orchards, in close proximity to human habitation. It is more abundant in these man-made habitats than it is in natural grassland. It prefers relatively deep, heavy soils, in which it digs extensive burrows. Its diet mainly consists of the green parts of plants and seeds, supplemented by invertebrates and, occasionally, small vertebrates. At high densities, it can be an agricultural pest (Nechay 2000).","Its decline in western Europe has been attributed to a combination of persecution and agricultural intensification. It was trapped and poisoned to prevent damage to crops, and this practice continues in some parts of the hamster's range (although not in the western part of its range). In eastern Europe it continues to be trapped for the fur trade. Agricultural intensification, specifically the loss of perennial crops and small uncultivated patches of land, the introduction of autumn-sown cereals, and the increased use of pesticides, has had a negative impact on many hamster populations. Changing agricultural practices in eastern Europe, where the hamster population has traditionally been considered stable, may pose a threat in the future.","It has undergone severe range and population declines in western and central Europe, and it now has a highly fragmented distribution in these areas. Subpopulation extinctions have occurred in a number of countries including Belgium, the Netherlands, France and Germany. Less is known about the status of the species in eastern Europe and Russia, but it is certainly more abundant there than in the west. Spring population densities of 0.5-3 individuals per hectare are reported in western Europe (Weinhold 1999), whereas densities of 3.4-37 occupied burrows per hectare have been recorded in Hungary (Nechay 2000). In Ukraine the species is considered abundant (I. Zagorodnyuk pers. comm. 2006). In areas where the species is abundant, periodic population outbreaks occur (Nechay 2000).",Decreasing,"<em>Cricetus cricetus </em>has a large global range, extending from western Europe, through central and eastern Europe, Russia, and Kazakhstan, reaching as far east as the Yenisey river (Asian Russia). In Europe, it occurs from Belgium, the Netherlands and northern France in the west to Russia in the east, and from northern Germany, Poland and Russia in the north to Bulgaria in the south (Panteleyev 1998, Weinhold 1999). It is found from sea level to 650 m (Nechay 2000).",,Terrestrial,"It is listed on Appendix II of the Bern Convention and Annex IV of the EU Habitats and Species Directive. Specific conservation recommendations to improve the status of the species in western Europe are detailed in Stubbe and Stubbe (1998) and Nechay (2000). These focus on subsidising farmers to manage agricultural habitats appropriately, and minimising use of pesticides. In the last few years, reintroductions have been carried out in France, Belgium and the Netherlands. Monitoring is required in eastern range states to determine population trends.",Palearctic,,false,false,Europe
111875852,5529,Cricetus cricetus,Critically Endangered,A3c,2020,2019-06-20 00:00:00 UTC,3.1,English,"<p></p><p>This species is listed as Critically Endangered under criterion A3ac in view of the rapid decline in the reproduction rate of the Common Hamster which indicates a suspected population reduction of 50% per year throughout large portions of the species distribution (equivalent to a reduction of at least 99% over the next ten years). This decline is ongoing and is likely to result in extinction of this species, projected to occur within the period 2020-2050 if nothing changes.</p>  <p>The Common Hamster's range has declined in almost all European countries. Local and regional extirpations and extinctions have occurred in 13 European countries and in both the European and Asiatic parts of Russia. These include nearly 67% of the range states for this species. The decline does not affect only West European countries, but also affects the global range with declines in Russia and the eastern part of its range evidenced. From the previous assessment in 2016 there has been an estimated decline in the species area of occupancy of 226,835 km² and a 468,634 km² decline in its extent of occurrence.</p><br/><p></p>","Its original habitat was fertile steppe and grassland, but it has successfully spread into a variety of anthropogenic habitats including meadows, croplands (especially cereals), and field edges, road verges and scrubby fallow areas on farms. In eastern parts of its range it is found quite often in gardens and orchards, in close proximity to human habitation. It is more abundant in these man-made habitats than it is in natural grassland. It prefers relatively deep, heavy soils, in which it digs extensive burrows. Its diet mainly consists of the green parts of plants and seeds, supplemented by invertebrates and, occasionally, small vertebrates. At high densities it is considered an agricultural pest in some areas (Nechay 2000).","The causes of the global decline are complex, are not fully understood yet, and there are many hypotheses attempting to explain the breakdown of the species. Research to identify the most important factors driving this decline is urgently needed.  The decline in Western Europe has been attributed to a combination of persecution and agricultural intensification. Habitat loss and fragmentation due to intensive building of industrial estates, alongside the improvement of road networks and infrastructure, are severely disturbing natural population dynamics and lead to highly endangered “island populations”.  Habitat fragmentation also causes loss of genetic diversity (Banaszek <em>et al</em>. 2011; Banaszek and Ziomek 2012; La Haye <em>et al</em>. 2012; Neuman <em>et al</em>. 2004, 2005; Reiners <em>et al</em>. 2014). Agricultural intensification—specifically the loss of perennial crops, the lack of crop diversity, large scale monocultural farming, and the use of pesticides—are suspected to have a negative impact. Moreover, it was shown in Alsace that body mass of the hamsters at emergence from hibernation decreased by 20% in the last 70 years. It was suggested that maize monocultures and climate change have such adverse effects on body mass (Tissier <em>et al</em>. 2016).<br/> <br/> The current change in agricultural practices in Central and Eastern Europe is a real threat in the near future (Hegyeli <em>et al</em>. 2015). In former times, Common Hamster was trapped and poisoned to prevent damage to crops. The hamsters were also trapped for the fur trade (Nechay 2000). A recent analysis of reproduction parameters revealed a global decrease in the number of litters, embryos and newborns to such an extent that the populations potentially might shrink by 50% each year. The reasons for reproduction breakdown most probably are related to climate change, light pollution, or fur trapping in the past (Surov <em>et al</em>. 2016).  Light pollution is an often underestimated threat. It acts on the physiology and behaviour of the species through endocrine and neurobiological processes which affect, amongst others, reproduction in birds and mammals (for a review see Navara and Nelson 2007, Gaston <em>et al</em>. 2013). For the Common Hamster there is not only a spatial coincidence between highly light polluted areas and areas with the strongest decline but also a temporal coincidence between the period of decline and increasing light intensities (Surov <em>et al</em>. 2016). Moreover, light exposure during only two winter nights shifted the onset of its reproductive phase by 3-4 weeks (Monecke <em>et al</em>. 2010). The fact that, nevertheless, some populations are doing quite well in a few cities is not a contradiction: good food availability and rain-sheltered areas within a town might override the negative effect of light pollution in these populations.","<em>Cricetus cricetus</em> has undergone severe range and population declines in Western, Central and Eastern Europe, and now has a highly fragmented distribution in these areas. The decline of the Common Hamster's range and numbers covers its whole distribution range (see Surov <em>et al</em>. 2016 for detailed analysis with maps). Extirpations and extinction on local and regional scales have occurred in a number of countries including Belgium, The Netherlands, France, Austria, Germany, Poland, the Czech Republic, Hungary, Slovakia, Ukraine, Belarus and Russia (Ambros <em>et al</em>. 2003, Bihari 2003, Demyanchik 2004, Ziomek and Banaszek 2007, Tkadlec <em>et </em>al. 2012, Sidorov <em>et al</em>. 2011, Rusin <em>et al</em>. 2013, Surov <em>et al</em>. 2016). The species is extinct in Switzerland (Hediger 1944, Mohr 1954, no recent records) and most probably in Georgia, where it was present in one locality (Vinogradov and Gromov 1952, Bukhnikashvili and Kandaurov 2004). To the best knowledge of the assessors, it was never present in Luxembourg which was listed as country of occurrence in the previous assessment.<br/><br/>In general, decline was shown in each country where monitoring of the species was performed. The relative occurrence of the Common Hamster before and after 1970 was compared in Russian, Belarus and Ukrainian provinces, and Moldova. Before 1970, the Common Hamster was abundant in 28 provinces, common in 37 and rare in 20. Today, the species is abundant only in eight and common in 27 provinces, but it is rare in 42 and extinct in eight provinces. Moreover, the species' range is becoming or is already fragmented, due to it vanishing from more than 75% of its range in Central and Eastern Europe. There are only seven fragments in eastern part of the range where the species is common or abundant: two are in Ukraine, one in Caucasus, two in Volga and Ural area and two in Siberia. Nevertheless, the most important fact is that population decline and fragmentation in general concerns the whole eastern range (Surov <em>et al</em>. 2016).",Decreasing,"<em>Cricetus cricetus</em> has a large global range, extending from Western Europe, through Central and Eastern Europe, Russia and Kazakhstan, reaching as far East as the Yenisey river (Asian Russia). In Europe, it occurs from Belgium, the Netherlands and Eastern France (Alsace) in the West to Russia in the East, and from central Germany, Poland and Russia in the North to Bulgaria in the South (Panteleyev 1998, Weinhold 1999). It is found from sea level to 650 m (Nechay 2000).","<p>In the past the Common Hamsters were intensively used in fur trade. Tens of millions individuals were harvested annually, but this hunting pressure had ended by 1970s in most of the species' range. Hunting continues only in Hungary (on a very limited scale).</p>",Terrestrial,"The species is listed on Appendix II of the Bern Convention and Annex IV of the EU Habitats and Species Directive. Specific conservation recommendations to improve the status of the species in Western Europe are detailed in Stubbe and Stubbe (1998), Nechay (2000), Weinhold (2009) and various other authors. These focus on subsidizing farmers to manage agricultural habitats appropriately, to restore key habitat elements, such as lucerne fields, offering cover and food after harvest, and minimizing the use of pesticides.<br/> <br/> In recent years reintroductions have been carried out in France, Belgium, the Netherlands and Germany and this conservation measure seems the most successful so far as it stops local population decrease.<br/> <br/> The Standing Committee of the Bern Convention adopted an action plan for the conservation of the European Hamster in 2009 (Weinhold 2009), recommending the urgent need to update population data and trends in the Eastern part of the range as well as the preparation of protection plans in those countries. Conservation measures are currently carried out and monitoring of population trends takes place regularly only in Western Europe (Belgium, France, The Netherlands, Germany and Austria). These are four out of 18 countries belonging to the range of <em>Cricetus cricetus</em> where it is extant. Monitoring of the species was performed in several other countries (i.e., in Poland, Czech Republic and Ukraine, partially in Belarus, Slovakia, Romania and Russia). Monitoring is urgently needed in remaining range countries. Conservation plans should also be developed for most of the countries from this species' range; such a national plan is currently under development in Poland.",Palearctic,,false,false,Global
