assessmentId,internalTaxonId,scientificName,redlistCategory,redlistCriteria,yearPublished,assessmentDate,criteriaVersion,language,rationale,habitat,threats,population,populationTrend,range,useTrade,systems,conservationActions,realm,yearLastSeen,possiblyExtinct,possiblyExtinctInTheWild,scopes
61977139,13895,Moschus chrysogaster,Endangered,A2cd,2016,2014-11-20 00:00:00 UTC,3.1,English,"Confirmed as Endangered because of a probable serious population decline, estimated to be more than 50% over the last three generations (approximately 21 years), inferred from over-exploitation, shrinkage in distribution, and habitat destruction and degradation. Although there is no direct data available regarding recent declining population rates, the above-mentioned rate of decline seems reasonable based on the high levels of harvesting and habitat loss. It should also be noted that a widely repeated but poorly documented estimate is that there were 180,000 wild individuals in China in the 1960s and 1970s (Yang <em><em><em><em><em>et al.</em></em></em></em></em> 2003, Zhou <em><em><em><em><em>et al.</em></em></em></em></em> 2004), but Sheng (1998) reported no more than 100,000 within China in the 1990s. No substantive new information on the species' status was received for the re-assessment.","This species is found on barren plateaus at high altitudes, where it occupies meadows, fell-fields, shrublands or fir forests, typically preferring shaded steeper slopes with less human disturbance. In western Sichuan, where it overlaps the distribution of <em>M. berezovskii</em>, the alpine musk deer inhabits the higher elevations (above 2,000 m asl, usually 4,000-4,500 m asl), compared with the 1,0002,500 m altitudinal range of <em>M. berezovskii</em>. <br/><br/>It is predominantly a browser, feeding mainly on shrubs, forbs, leaves, moss, lichens, shoots, grasses, and twigs (Green 1987). The proportion of leaves and tender shoots in the diet is highest in spring and summer, buds and flowers in late summer, and leaves, twigs and flowers of forbs and shrubs later in the year (Wilson and Mittermeier 2011, Syed and Ilyas 2012).<br/><br/>Its main predators include yellow-throated marten, fox, wolf, and lynx. Snow leopard reportedly preys on the species in Nepal (Aryal <em><em>et al.</em></em> 2010) It is generally solitary and crepuscular (Harris and Cai 1993). Population density varies from 3.9 /km² in more arid habitats to 71 /km² in areas with higher rainfall. Densities are lower in areas with heavy snow cover and where there are more competitors (goral, serow and domestic cattle).<br/><br/>Breeding occurs primarily in November-December, with the resulting offspring being born from May to June. After birth, young deer lie hidden in secluded areas, essentially independent of their mothers except at feeding times. This hiding period may last up to 2 months. Gestation is variously reported at from 150-195 days (Hayssen <em><em>et al.</em></em> 1993) and give birth to one offspring (twins are sometimes reported by documentation is lacking). Fawns wean at 3-4 months, are sexually mature at 16-24 months. <br/><br/>Alpine musk deer is sedentary, tending to remain within defined home ranges. In females these are about 125 acres in size, while males will control a territory that encompasses the ranges of several females, possibly defending it against other males. The species is not known to migrate. Communication between individuals is thought to be based primarily on their sense of smell, due to the high development of the glands of musk deer. It is primarily silent, musk deer will emit a loud double hiss if alarmed.","The musk produced by this genus of primitive deer is highly valued for its cosmetic and alleged pharmaceutical properties, and can fetch U.S. $45,000 per kilogram (2.2 pounds) on the international market. Although this musk, produced in a gland of the males, can be extracted from live animals, most ""musk-gatherers"" kill the animals to remove the entire sac, which yields only about 25 grams (1/40 of a kilogram) of the brown waxy substance. Such poaching is relatively easy to accomplish and difficult to stop using only legal means (Harris 1991, 2007). In Nepal, the increased price of musk deer on the international market has reportedly led to an increase in poaching and trade in the Himalayas (Aryal <em>et al.</em> 2010). Poaching and trade of the species for musk is described as ""unabated"" and the principle threat in Uttarakhand, India (Ilyas 2014).<br/><br/>Musk deer also appear to require dense vegetation, either in the form of intact forests or shrublands, thus excessive forest clearing or grazing can preclude musk deer from using such lands (Yang <em>et al.</em> 2003). Furthermore, grazing of livestock within protected areas may pose a threat to musk deer through both competition and through disease transmission (Aryal <em>et al.</em> 2010).","Estimating population sizes or trends for musk deer is very difficult, and has rarely been done satisfactorily. Population estimates over large-scale areas are subject to considerable uncertainty (and this is exacerbated by uncertainty over taxonomy). A widely repeated but poorly documented estimate is that there were 180,000 individuals in the 1960s and 1970s (Yang <em><em><em>et al.</em></em></em> 2003, Zhou <em><em><em>et al.</em></em></em> 2004), but Sheng (1998) reported no more than 100,000 within China in the 1990s.<br/><br/>Liu and Sheng (2002) estimated population sizes in three Chinese nature reserves in the mid 1990s using extrapolations from counts of pellet groups, but provided few details. They estimated 183227 in the Helan Mountain Nature Reserve in Ningxia, 131-160 in the Shoulu Mountain Nature Reserve in Gansu, and 4,717-5,798 in the Xinglong Mountain Nature Reserve in Gansu. More recent reports suggest that the species has become very rare in the Helan Mountains (Liu, Z.S., East China Normal University pers. comm., 2006) and has been severely depleted since in northwest Yunnan as a result of overexploitation. Snaring has become one of the main threats to the species in northwest Yunnan (Xueyou and Xuelong 2014).<br/><br/>Anecdotal evidence points to a continued decline in abundance within China. Although population estimates contained in Yang <em><em><em>et al.</em></em></em> (2003) are unreliable, data on musk purchased by local Traditional Chinese Medicine companies probably reflect real trends, and these suggested dramatic declines in musk deer populations during the 1970s and 1980s, particularly in Sichuan, Yunnan, Qinghai, Tibet, and Shaanxi. <br/><br/>In Nepal, within protected areas the numbers of the species is reportedly increasing (Aryal <em><em><em>et al.</em></em></em> 2010). There is an estimated 600-800 animals in Sagarmatha National Park at densities of up to 45/km², more than 1000 in Shey-Phoksundo National Park, an estimated 500 animals in Langtang National Park, and it also occurs in Annapurna Conservation Area, Kanchanjunga Conservation Area, Dhorpatan Hunting Reserve Khaptad National Park and Makulu-Barun National Park. Outside of protected areas the species is declining (Aryal <em><em><em>et al.</em></em></em> 2010).",Decreasing,"This species occurs from the highlands of central China (the Helan mountains form the northern edge of the distribution), south and west to the Himalayas, extending to eastern Nepal, Bhutan, and northeastern India (Sathyakumar 2002, Wemmer 1998). It is widely but discontinuously distributed across the mountainous parts of the Himalayas (Aryal <em><em><em><em>et al.</em></em></em></em> 2010). Records from Afghanistan and Pakistan refer to Moschus cupreus. This species is found at elevations of 2,000-5,000 m asl.<br/><br/>Within China, which comprises the bulk of its range, it is found in southern Gansu, southern Ningxia, Qinghai, western Sichuan, southern Tibet, and northern Yunnan.","For information on use and trade, see under Threats.",Terrestrial,"This species is listed on CITES Appendix II in China, and on Appendix I in the other countries within its range. The sifanicus subspecies is on the China Red List as Critically Endangered (A1acd+B1ab(i,ii,iii)), and was changed from category II to category I on the China Key List in February 2003. Captive breeding, primarily for commercial musk production, occurs in various places in China, and might have some conservation benefit. However, to date, there is little evidence that the availability of musk from captive-bred animals has had a positive conservation impact (Parry-Jones and Wu 2001, Green <em>et al.</em> 2007, Harris 2007). In Pakistan, the species is listed as Critically Endangered (Sheikh and Molur 2005).",Palearctic,,false,false,Global
61977357,13896,Moschus fuscus,Endangered,A2cd,2015,2015-02-04 00:00:00 UTC,3.1,English,"This species is listed as Endangered because of a probable serious population decline, suspected to be more than 50% over the last three generations (approximately 21 years), caused by over-exploitation, shrinkage in distribution, &#160;habitat destruction and degradation. Although there are no direct data available regarding recent declining population rates, the above-mentioned rate of decline seems reasonable based on the high levels of harvesting and habitat loss. It should also be noted that it has a relatively restricted range. No new information was received in 2014 to enable full re-assessment of this species.","This species is found near the tree line in <em>Rhododendron</em> and coniferous forests, forest-edge and rocky ridges at high elevations (2,600-4,200 m asl). This is a poorly-known form; all life-history attributes are likely similar to those of the Alpine Musk Deer (<em>M. chrysogaster</em>).","The musk produced by this genus of primitive deer is highly valued for its cosmetic and alleged pharmaceutical properties, and can fetch U.S.$45,000 per kilogram (2.2 pounds) on the international market. Although this musk, produced in a gland of the males, can be extracted from live animals, most ""musk-gatherers"" kill the animals to remove the entire sac, which yields only about 25 grams (1/40 of a kilogram) of the brown waxy substance. Such poaching is relatively easy to accomplish and difficult to stop using only legal means (Harris 2007). There is hunting and illegal trade for musk glands from Myanmar to China (Than Zaw pers. comm.). The threat from trade is increasing (Than Zaw pers. comm.).<br/><br/>Musk Deer appear to require dense vegetation, either in the form of intact forests or shrublands; thus excessive forest clearing or grazing can preclude&#160;Musk Deer&#160;from using such lands (Yang <em>et al</em>. 2003).","Estimating population size or trend for Musk Deer is very difficult, and has rarely been done satisfactorily. Population estimates over large-scale areas are subject to considerable uncertainty (and this is exacerbated by uncertainty over taxonomy). No rigorous population estimates exist within China. According to Wang (1998), this species is very rare, making up less than 10% of&#160;Musk Deer&#160;found even within Yunnan, with even fewer reported from Tibet. Yang <em>et al</em>. (2003) considered the species quite rare, perhaps on the verge of extinction. This species is very rare within Myanmar (Than Zaw pers. comm.). Musk glands were exported from Myanmar, and there have been many skin samples from Myanmar as well.&#160;This species was recorded via camera-trap photos between 2008 and 2010 in Khangchendzonga Biosphere Reserve, Sikkim, India (Sathyakumar&#160;<em>et al.</em>&#160;2011).&#160;There is also one recent camera trap record from Khakaborazi National Park, Myanmar (Than Zaw pers. comm.).",Decreasing,"This species occurs in China (northwestern Yunnan and southeastern Tibet), northern Myanmar, northeastern India (Arunachal Pradesh), Bhutan and eastern Nepal (Grubb 2005). It is reported at elevations of 2,600-4,200 m asl. Within Yunnan, China, it is distributed in Gongshan, Fugong and Bijiang counties (Wang unpublished data 2008).","The musk produced by this genus of primitive deer is highly valued for its cosmetic and alleged pharmaceutical properties, and can fetch U.S.$45,000 per kilogram (2.2 pounds) on the international market.",Terrestrial,"This species is listed on CITES Appendix II in China, and on Appendix I in the other countries within its range. It is on the China Red List as Critically Endangered (A1acd+B1ab(i,ii,iii)), and the China Key List as category II. This species has become nominally protected in Myanmar with the creation Khakaborazi National Park, but enforcement of hunting has a long way to go (Than Zaw and J.W. Duckworth pers. comm.).",Indomalayan,,false,false,Global
61977573,13897,Moschus moschiferus,Vulnerable,A2d+3d+4d,2015,2014-11-17 00:00:00 UTC,3.1,English,"In the 1970s the population size was estimated at 60,000-80,000 in Mongolia (Dulamtseren 1977). The Institute of Biology of the Mongolian Academy of Science assessed the Mongolian population size in 1986 over 53,000 hectares across 63 units of six provinces, resulting in an estimate of 44,000 individuals. The population size is continuing to decrease: densities fell from six per 5 km<sup>2</sup>, to one per 5 km<sup>2</sup> in one observed population between 1990 and 2000 (Tsendjav and Bujinkhand 2000, Tsendjav 2002). Similar levels of declines due to poaching are believed to have taken place elsewhere within its range. Generation length has been estimated as six years based on data from Nowak (1991). As the causes of this decline, primarily exploitation, is expected to result in a population reduction of at least 30% over the next three generations, <em>Moschus moschiferus</em> qualifies as Vulnerable under Criterion A3d, and as well as A2d and A4d because of past declines. Further research could show that the species is declining more seriously than has been supposed, and could possible qualify for listing as Endangered.","Inhabiting mountainous taiga (broadleaf and needle forest), these animals are typically found in forests of dense birch (<em>Betula</em> spp.) and larch (<em>Larix</em> spp.), and shrub-covered slopes in sub-alpine zones (Dulamtseren 1977, Dulamtseren <em>et al</em>. 1989, Tsendjav 2002). In Russia it inhabits the mid-mountain belt where it prefers dark coniferous forest with dense shrubs and rocky outcrops, using such rocky areas to escape from predators (Prohod’ko 2002). However, lichens are the main part of Siberian Musk Deer diet, accounting for up to 99% of the food intake in winter. During the rest of the year the percentage of lichen in the diet is still high, but these deer also consume grasses, leaves and mushrooms. When feeding it is able to climb on inclined trunks up to 3-4 m above ground. Population density is highly correlated with the availability of food and hiding places. The average population density is about 0.6 animals per square kilometre, although under favourable conditions this may be as high as 4-8.5 animals per square kilometre (Prohod’ko 2002). It has a thick coat for insulation and is well adapted for walking through deep snow.  The species is preyed upon by a suite of predators including lynx, wolverine, yellow-throated marten, and rarely wolf, tiger, and bear. When chased, musk deer head for rocky terrain, and will try to reach an inaccessible crag or a shelter. If neither is available, the animal begins to run in circles. Although they can run exceptionally fast, musk deer tire after only 200-300 metres.<br/><br/>It is solitary, though it sometimes occurs in small groups (no more than three individuals) of a female with her young. In the Altai, family groups consist usually of an adult permanent pair and the young of the year. The territory of female and young lies within the territory of a male. Sometimes the group includes young males up to two years old, that are submissive to the adult male, but actively participate in making and protecting common territory (Prohod’ko 2002). The species is primarily active at dusk and dawn. While foraging, a musk deer may travel 3-7 km per night, generally returning to the same spot (a ""lair"") every morning. Individuals inhabit home ranges between 200 and 300 hectares in size, sticking to the boundaries steadfastly. The size of the home range decreases markedly during the second half of winter. Seasonal migrations are minimal if present at all. Reproduction starts in December, although some females do not mate until March (Prohod’ko 2002). Females gestate for just over 6 months, and give birth to 1-3 offspring, usually in May or June. Young wean at 3-4 months, and are mature at 15-17 months. Animals live in the wild for 10-14 years.","As the common name suggests, males secrete musk from a preputial gland (the “musk-pod”). This musk forms the basis for many perfumes, and is highly valued for traditional medicines (Wemmer 1998). Each male produces only around 25 g of musk (Dulamtseren <em>et al</em>. 1989, Tsendjav 2002). Although this musk can be extracted from live animals, most ""musk-gatherers"" kill the animals to remove the entire sac.<br/><br/>Illegal, unsustainable hunting for musk is the principal threat to this species. An estimated 25,000 adult males were killed through harvesting and illegal hunting between 1990 and 2001 (Homes 2004). As hunting is often indiscriminate of sex and age, four to five Siberian Musk Deer are estimated to be killed per musk-pod harvested (Green 1987). As cheaper, synthetic alternatives for making perfumes are becoming more popular, use of musk in the perfume industry is decreasing, but its value for cardiac, circulatory and respiratory traditional medicines remains high. During the 1970s, the international market value of musk reached up to US$45,000 per kg. Between 1995 and 2001, the number of traders in musk increased six-fold, following a similar increase in the market price of musk-pods (Zahler <em>et al</em>. 2004).&#160;<br/><br/>Resource extraction such as mining is not causing a substantial loss of habitat at present, but the resulting human disturbance from this activity does constitute a threat. Habitat fragmentation may also threaten the species (Tsendjav and Bujinkhand 2000).","During the 1920s and 1930s numbers were sharply reduced through hunting. In the 1970s the Mongolian population size was estimated to be between 60,000 and 80,000 animals (Dulamtseren 1977). In 1986, the Institute of Biology of the Mongolian Academy of Science assessed Musk Deer population sizes in over 53,000 hectares across 63 units of six provinces, resulting in an estimate of approximately 44,000 individuals. The population size in Mongolia continued to decrease: between 1990 and 2000, densities fell from six per 5 km<sup>2</sup>, to one per 5 km<sup>2</sup>&#160;in one observed population (Tsendjav and Bujinkhand 2000, Tsendjav 2002). Likewise, all populations in Russia are considered declining. Population estimates from the Bureau of Sport Fisheries and Wildlife in 1999 put the Sakhalin population at about 600-650 individuals (still declining), the Eastern Siberian population at about 27,000-30,000 individuals, and the population in the Russian Far East at up to 150,000 individuals (K. Tsytsulina pers. comm.).&#160;<span lang=""EN-US"">In 2011, across 10 federal regions of Siberia the total population of the species was estimated at approximately 110,000 individuals (Federal Service for Supervision of Natural Resources 2012). Equivalent data appear not to be available for China or the Koreas, but this species is believed to be declining heavily there also. It is believed to be contracting in range in China, and had apparently disappeared from Xinjiang by the end of the 19<sup>th</sup> century.",Decreasing,"This species occurs widely in the Russian Federation (Siberia and the Far East), extreme eastern Kazakhstan, northeastern and northwestern China, Mongolia, Republic of Korea and Democratic People's Republic of Korea (Tsendjav 2002). Records from Afghanistan, Pakistan, India, Kyrgyzstan, Nepal, Bhutan, Myanmar and Viet Nam refer to other species in the genus <em>Moschus</em>. Four subspecies occur in Russia: <em>M. m. moschiferus</em> (Siberia); <em>M. m. turovi</em> (Russian Far East); <em>M. m. arcticus</em> (Verkhoyansk Ridge); and <em>M. m. sachalinensis</em> (Sakhalin Island). In Mongolia, <em>M. m. moschiferus</em> is found regionally in the forested habitats in the northern Mongol Altai mountain range (Togtokhbayar <em>et al</em>., 2000), Hangai mountain range (Sosorburam 1970, Dulamtseren 1977, Dulamtseren <em>et al</em>. 1989), Hentii and Hövsgöl mountain ranges, and possibly around Han Höhii Mountain in the western Hangai mountain range (Dulamtseren <em>et al</em>. 1989, Wemmer 1998, Tsendjav 2002). Two subspecies are found in China: <em>M. m. moschiferus</em> in Xinjiang (Altai mountains), Nei Mongol, and Heilongjiang; and <em>M. m. parvipes</em> along the border with North Korea in the Lesser Xing’an and Changbai mountain ranges, as far west as Ordos Plateau. <em>M. m. parvipes</em> occurs widely in both North and South Korea.",For details on Use and Trade see under Threats.,Terrestrial,"This species is listed under CITES Appendix II. The Sakhalin subspecies (<em>M. m. sachaliensis</em>) is listed in Red List of Russian Federation as Category I (Critically Endangered). It is protected as Very Rare under part 7.1 of the Law of the Mongolian Animal Kingdom (2000). Hunting in Mongolia has been prohibited since 1953, and it is protected as Very Rare under the 1995 Mongolian Hunting Law (MNE 1996).&#160;<span lang=""EN-US"">It is also on the 2014 Chinese Red List as Critically Endangered A1acd+B1ab(i, ii, iii), and is included on the China Key List - II.<br/>In Russia it is present in a number of protected areas. Approximately 13% of the species’ range in Mongolia occurs within protected areas.&#160;More than 1.5 million hectares of the range of this species is included within Horgo Terkhiin Tsagaan Nuur National Park (Hangai Mountain Range), Hövsgöl Nuur National Park (Hövsgöl Mountain Range), and Gorkhi Terelj National Park, Bogd Khan Uul Strictly Protected Area, and Khan Hentii Strictly Protected Area in Hentii Mountain Range (Wemmer 1998).<br/><br/>The following conservation measures are needed through its range (Wang <em>et al</em> 1993, Wemmer <em>et al</em> 1998):<ul><li>Enhance enforcement of existing protective legislature, particularly relating to trade in musk through increased vigilance within protected areas and by customs agents at border crossings.</li><li>Conduct further ecological research and monitor population trends, including on population dynamics, dispersal, and the effects of harvesting. No national surveys of Siberian musk deer population size have been conducted for over 30 years (Homes 2004).</li><li>Regulate illegal logging and human-caused fires within its range (R. Reading pers. comm.).</li><li>Organise a workshop including representatives from Mongolia, China, Russia and the Koreas to focus international efforts on conservation and to agree upon realistic yet effective solutions to threats faced by this species (Homes 2004).</li><li>Identify substitutes for musk which would be acceptable in traditional forms of East Asian medicine (Homes 2004).</li></ul><br/>The species is successfully bred in captivity at musk deer farms, especially in Russia (in the Altai and Moscow regions) and China.",Palearctic,,false,false,Global
