assessmentId,internalTaxonId,scientificName,redlistCategory,redlistCriteria,yearPublished,assessmentDate,criteriaVersion,language,rationale,habitat,threats,population,populationTrend,range,useTrade,systems,conservationActions,realm,yearLastSeen,possiblyExtinct,possiblyExtinctInTheWild,scopes
22264197,20494,Urocitellus undulatus,Least Concern,,2016,2016-08-18 00:00:00 UTC,3.1,English,"This species has a large population size and a wide distribution. No decline in population size has been detected, and there are no known widespread major threats.","Inhabits semi-desert and mountain steppe habitats along the edge of forests. In China found in thinly wooded savannas and grassy steppes bordering the Gobi desert. In addition to grasslands, they occupy bushy terrain among oaks and white or black beech groves, alpine meadows, and wet areas along river valleys.  Lives in colonies with a labyrinth of burrows.  Burrows are characteristically 8-13 cm in diameter and surrounded by a large mound of soil (up to 2 m in diameter and 40 cm high)  Diurnally active; although most active at dawn and dusk. Diet consists of green vegetation and seeds, but also insects.  Before hibernating makes a store of vegetation to utilize following arousal.  Hibernates from October until late March/mid April.  Reproduce once per year in spring; litters of 3-9 young are produced following a 30 day gestation. Start mating on second year.","Hunting for international trade in skins once occurred at high levels, between 1958 and 1960 it was estimated that as many as 418,400-551,000 individuals were killed annually (Stubbe 1965). This activity is now believed to have ceased and no other threats are known to be impacting upon this species at present.","It is common and sometimes abundant species. Population size very much differs depending on the habitat. For example, in Transbaikalia in steppe river valleys population density is up to 250 burrows per ha (Badmaev 1996). In Tuva it is about 100 burrows per ha (Ol'kova 1962). In other habitats density is much lower, in wormwood and cereal steppe it is about 5 animals per ha, and in subalpine zone it is 1-2 animals per ha (Shilova and Savinetskaya, Biodiversity Conservation Centre web-site, in Russian).",Stable,"Distributed in mountain forest-steppes and steppes from Southern Siberia and Altai (Russia) to Manchuria. Two isolated population in north, in Yakutia (S. u. jacuensis) and east of the range, between Amur and Burei Rivers in Russia and N Heilongjiang in China (S. u. menzbieri). In China distributed in Altai and Sayan mountains; Xinjiang, Altai mountains; Xinjiang, Tian Shan mountains. In Mongolia found in Mongol Altai, Hangai, Hövsgöl and Hentii mountain ranges, as far south as Aj Bogd Massif in Trans Altai Govi Desert. Recently recorded in the northern portions of Ikh Nartiin Chuluu Nature Reserve in Eastern Govi.",Hunted for human use.,Terrestrial,Occurs in some protected areas (approximately 11% of the species’ range in Mongolia).,Palearctic,,false,false,Global
45202281,23036,Viverra civettina,Critically Endangered,C2a(i),2016,2015-03-03 00:00:00 UTC,3.1,English,"This species is listed as Critically Endangered (Possibly Extinct) because there are no recent reliable records of wild individuals and none are known in captivity.&#160;Various&#160;surveys during 1990-2014 in potentially suitable habitats across its purported distribution range have generated no records, despite using techniques that reliably find related species when they are present (notably, camera-trapping). This lack of records despite these surveys indicates that its population, if extant at all, is likely to number fewer than 250 mature individuals, with no subpopulation greater than 50 individuals. A continuing decline is inferred from the lack of any recent records (Nandini and Mudappa 2010). Its distribution and ecology are effectively unknown, because there are no reliable documented records, ever, of the species in the wild (Nandini and Mudappa 2010). The species is known only from eight specimens collected over a century ago and four more recently, with the last in 1989 (Nandini and Mudappa 2010).","There is no reliable information about Malabar Civet's habitat use or other aspects of its ecology. The several descriptions of habitat use are speculative or based in whole or part on confusion with other species. It seems that it once inhabited lowland forests, lowland swamp and riparian forests in the coastal plain districts of the Western Ghats. Village reports suggested occurrence in thickets in cashew plantations and in highly degraded lowland forests in northern Kerala (Ashraf <em>et al</em>. 1993). It could possibly occur in lowland riparian forests in the coastal plain districts (Ashraf <em>et al</em>. 1993). Based on the natural history of congeners, the species is probably nocturnal, ground-dwelling and readily camera-trapped when present.<br/> <br/> Natural forests have completely disappeared from the coastal Western Ghats. Present vegetation is secondary in origin (Champion and Seth 1968), and is mostly plantations (Ashraf <em>et al</em>. 1993). Of these, cashew plantations are the least disturbed, because they are not weeded, providing a dense understorey of shrubs and grasses for this ground-living species to take refuge in (Ashraf <em>et al</em>. 1993). The pelt records from 1980-1990 were in the region of river valleys, suggesting a possible association with shallow water courses (Ashraf <em>et al</em>, 1993). The closely related Large-spotted Civet is strongly associated with the forested level lowlands (e.g., Chutipong <em>et al</em>. 2014); whether this is also true of Malabar Civet, which occurs within a rather different small carnivore community (notably, no other species of <em>Viverra</em>&#160;overlaps with it) is unknown.","Assuming habitat use similar to that of&#160;Large-spotted Civet,&#160;Malabar Civet&#160;is likely to have undergone a massive<span class=""apple-converted-space"">&#160;decline<span class=""apple-converted-space"">&#160;a century ago because of extensive conversion&#160;of forest to agriculture.&#160;Coastal plain forest was never extensive in&#160;its presumed range&#160;because the Western Ghats hill range run quite close to the coast along its&#160;length.&#160;Natural forests have completely disappeared from the coastal Western Ghats (Champion and Seth 1968).&#160;Land-use and habitat changes have not been too drastic in the last century within the assumed distribution range of the Malabar Civet.&#160;The records late in this period, if they were of wild animals, therefore suggest an ability to persist in today's habitat matrix, specifically in deforested areas and/or forest above the plains. In either case, many areas of potentially suitable habitat persist. Thus, habitat factors alone are unlikely to have been an unlikely driver of<span class=""apple-converted-space"">&#160;of its present extreme rarity.&#160;There may be significant loss of natural and semi-natural habitat over the next decade with many hydro-power projects being proposed in the region. Cashew plantations, which might hold most of the surviving populations of this species, are threatened by large-scale clearance (Ashraf&#160;<em>et al</em>. 1993).&#160;<br/> <br/> The use of civet-musk is said to have been widespread within this&#160;species's range&#160;during 1965-1970 (Ashraf <em>et al</em>. 1993). In the past, this species might have been used to collect civet oil, although there are no records to authenticate this claim. Small Indian Civet is still illegally ‘farmed’ and kept in captivity to extract civet, and any remaining Malabar Civets are likely to be at risk for the same reason.&#160;<br/><br/>Villagers report retaliatory killings of civets, taken by the interviewers to include Malabar Civet, for raiding poultry – although there is no hard evidence this species is killed for this reason. Once again it might be a case of mistaken identity between Malabar Civet and Small Indian Civet or even Common Palm Civet.&#160;The most recent skins apparently came from outside protected areas, suggesting that hunting is likely to remain a threat to this already rare species (Ashraf <em>et al</em> 1993). There are a few&#160;protected areas&#160;in the lowland of Kerala, but whether the species inhabits them is unknown.&#160;This species is not selectively hunted, but 10 of 22 reports of animals assessed by Ashraf&#160;<em>et al</em>. (1990) to relate to this species and made&#160;during 1950 to 1990 were caught by dogs;&#160;there is no evidence that these reports actually relate even in part to Malabar Civet. Whatever the proportion of report of retaliatory killing and hunting that truly relate to Malabar Civet, that these practices occur in the species's presumed range means that they are likely to threaten any remaining&#160;Malabar Civets.</span>","The population status is unknown but the lack of any even possible record since the advent of widespread camera-trapping suggests that very few animals, at most, persist. Three recent attempts to find the species failed (Jayson <em>et al</em>. 2007, Rao <em>et al</em>. 2007, Ashraf <em>et al</em>. 2009). <br/> <br/> This species was formerly believed to be very common in the districts of Malabar and Travancore in southwest India, based on Jerdon (1874). However, Nandini and Mudappa (2010) concluded that&#160;Jerdon’s statements were a case of misidentification of the more common (even now) Small Indian Civet, supporting Pocock’s (1933) doubts about Jerdon’s report. But by the late 1960s it was thought to be near extinction. No sighting was claimed until 1987; then, and subsequently, there have been no confirmed records of wild or captive animals: only equivocal sightings&#160;(without any supporting evidence to confirm the species identification)&#160;and dead animals plausibly from captivity (Nandini and Mudappa 2010).",Decreasing,"Malabar Civet is believed to be endemic to the Western Ghats of&#160;southern&#160;India. All records lack precise locality (historical&#160;specimens all came from zoo animals with no information on original&#160;source)&#160;and most have little or no information on origin. Taken together they suggest a distribution in the lowlands from Kanyakumari in the extreme south north to Wayanad, Coorg, and Honnavar in Karnataka (Pocock 1933, 1939, Corbet and Hill 1992, Nandini and Mudappa 2010). There are only two reports of its occurrence in the higher elevations (over 600 m) of the Western Ghats, in the High Wavy Mountains (Hutton 1949) and at Kudremukh (Karanth 1986). The former is very likely to be in error and the latter was&#160;based on a single-observer sight-record left unidentified for some years&#160;(Nandini and Mudappa 2010). By the late 1960s, the&#160;species&#160;was thought to be near extinction. In the decades until the late 1980s, there were only two possible records, from Kudremukh in Karnataka (Karanth 1986) and from&#160;Tiruvella in Kerala (Kurup 1989); both lack objectively verifiable evidence.&#160;Rai and Kumar (1993) reported possible occurrence in the&#160;state of&#160;Karnataka based on the sighting by Karanth (1986) and unsubstantiated interviews with local hunters.&#160;In the late 1980s, skins of recently killed Malabar Civets were obtained in Elayur, in the lowland Western Ghats, in Malappuram district, Kerala (Kurup 1989) and near Nilambur, northern Kerala (Ahsraf <em>et al.&#160;</em>1993), although&#160;these&#160;seem subsequently to have been lost.","The use of civet-musk is said to have been widespread within this&#160;species's range&#160;during 1965-1970 (Ashraf&#160;<em>et al</em>. 1993). In the past, this species might have been used to collect civet oil, although there are no records to authenticate this claim. Small Indian Civet is still illegally ‘farmed’ and kept in captivity to extract civet, and any remaining Malabar Civets are likely to be at risk for the same reason.",Terrestrial,"Malabar Civet is listed in Schedule I, part I of the Indian Wildlife (Protection) Act, 1972 and on CITES Appendix III (India). This species is not known to occur in any protected area and the declaration of large new protected areas in its range is unlikely because of the dense human populations (Ashraf <em>et al</em>. 1993). Ashraf <em>et a</em><em>l</em>. (1993) recommended the following conservation actions for this species: captive breeding (with the possibility of reintroduction if suitable undisturbed areas are identified), field surveys (to investigate whether this species occurs in protected areas) and ecological studies (to determine the threats to this species). An urgent conservation action plan is needed. Given that recently it has been not possible to find the species at all, the option of captive breeding is not currently practical. Reintroduction, assuming that some environmental threats have dissipated the populations, it would need considerable amount of work to nullify those threats having firstly established what they are. Field survey should be continued, although many in the last decade have not yielded any positive results (Jayson <em>et al</em>. 2007, Rao <em>et al</em>. 2007, Ashraf <em>et al</em>. 2009). As noted by Nandini and Mudappa (2010) in a detailed review of the knowledge of the Malabar Civet, none of the historical specimens have reliable provenance; and even for the more recent ones it is fairly vague: not one has&#160;a precise wild locality of origin. It therefore is imperative to assess the status of the specimens&#160;in various museums and collections using advanced techniques of molecular genetics. This should consider whether the species is in fact a valid taxon native to India, or an incidental result of the wide trans-shipment of various civet species that occurred around the Indian Ocean counties for many centuries.",Indomalayan,none certain,true,false,Global
45209955,41628,Mydaus javanensis,Least Concern,,2015,2015-03-03 00:00:00 UTC,3.1,English,"Sunda Stink-badger is listed as Least Concern because it is unlikely to meet any of the Red List criteria at levels&#160;sufficient for even Near Threatened.&#160;It has a large distributional range, occurring on Sumatra, Borneo, Java and the Natuna Islands. It is comparatively frequently camera-trapped over substantial areas of the three major islands, from the lowlands up to 2,000 m asl. On Borneo it seems now to be largely restricted to the northeast, although historically it was recorded from other regions in Kalimantan (Indonesian Borneo; see Samejima&#160;<em>et al</em>. in&#160;prep.). The reasons for the lack of recent records from large parts of Kalimantan are unknown (see Samejima&#160;<em>et al</em>. in&#160;prep.). However, any potential declines in these areas most probably occurred some decades ago, and not within the last 14 years (or three generations; Pacifici <em>et al</em>. 2013). Records from Sabah, Malaysian Borneo, indicate that this species uses disturbed forests (its occupancy being higher in more disturbed forests than in sustainably managed forests; Sollmann <em>et al</em>. in prep.) and palm oil plantations (A.J. Hearn and J. Ross pers. comm. 2014). This species evidently tolerates, perhaps even benefits from, some forms of habitat disturbance (Samejima&#160;<em>et al</em>. in prep.). Thus it is unlikely that it is experiencing major declines from the ongoing deforestation in the region. There is no evidence of its being recently targeted for food or medicine at levels&#160;sufficient&#160;to drive population declines at a pace to come near to even Near Threatened. Historical accounts, however, indicate that in the Indonesian part of Borneo, the species was frequently sought for food (see Samejima&#160;<em>et al</em>. in&#160;prep.), and hunting might have been one of the factors contributing to historical declines","Over its range,&#160;Sunda Stink-badger&#160;is found in primary and secondary forests and open grounds such as gardens adjacent to forests (Payne <em>et al</em>. 1985, Holden 2006). In Sabah it is found in both primary and disturbed forests and from the periphery out to a least four kilometres from the forest edge of oil-palm plantations. It is unknown how far it is able to venture into the plantation landscape. In Sarawak it has been recorded in a pepper garden (Samejima&#160;<em>et al</em>. in&#160;prep.). It is quite clear that it is not dependent upon primary forest. Camera-trapping at salt-licks in Sabah found it to be a common visitor (Matsubayashi <em>et al</em>. 2006).<br/><br/>This species feeds on birds'&#160;eggs, carrion, insects, worms and plants (Long and Killingley 1983, Neal and Cheeseman 1996, Payne&#160;<em>et al</em>.&#160;1985). Litter size is usually two to three (Wood 1865). It is nocturnal, sheltering in underground burrows during the day (Hwang and Larivière 2003).<br/><br/>It is currently unknown why the species has such a patchy distribution, especially on Borneo. The species' pattern of occurrence might be linked to earthworm density, soil characters, level of (perhaps mostly past) hunting and/or other factors.","Habitat loss is unlikely to be a significant threat to&#160;Sunda Stink-badger, and at least in parts of its range the widespread degradation and fragmentation of forest might be benefiting it, as might conversion of old-growth forest to some other uses. The threat posed by hunting is difficult to assess. It might, perhaps, have led to past declines and local extirpations, but the lack of a large commercial demand for it today and its persistence in many areas close to people suggests that hunting is not presently a threat.","This species occurs in a wide range of vegetation types, including - at least in Sabah, Malaysia - very disturbed areas and plantations. So the population is likely to be relatively unaffected by the large-scale forest conversion in its range. It is currently unknown why this species was reported as common in various parts of Kalimantan in the early 20th century, yet current records from these areas are lacking. For example, in the 1930s, this species was considered “to have a very wide distribution range, including all wet and dry forests of the area discussed here [southern and&#160;southeastern &#160;Borneo]. The density however is low. In eastern Borneo its occurrence was reported&#160;only&#160;from the area north of Samarinda, and in southern Borneo from only nine locations, which were dispersed and far from each other” (Nederlandsch-Indische Vereeniging tot Natuurbescherming 1939). Its distribution seems to be patchy (Payne <em>et al</em>. 1985). It is conceivable that local extinctions have occurred, perhaps&#160;through hunting. The overall population of the species is plausibly rather stable, given its high adaptability to changing habitats, at least over the time frame of three generations.",Stable,"Sunda Stink-badger is found on Java, Kalimantan (Borneo), Sumatra and the Natuna Islands in Indonesia, and in Sabah and Sarawak in Bornean Malaysia. So far there are no confirmed records from Brunei, but parts of the country are predicted to contain habitat&#160;suitable&#160;for the species (Samejima&#160;<em>et al</em>. in&#160;prep.). On Borneo it is among the most frequently recorded carnivore species in most camera-trapping studies in the Malaysian State of Sabah (Borneo Carnivore Symposium; Samejima&#160;<em>et al</em>. in&#160;prep.). It is found from the lowlands in central and eastern Sabah (e.g. Kinabatangan) up to the highlands in western Sabah (e.g. Crocker Range National Park, A. J. Hearn and J. Ross pers. comm. 2014). In Sarawak nearly all the rather few records are from the northeastern part (Limbang and North Miri division); records south of Miri division are very few, and local people often seem unfamiliar with the species (Giman and Jukie 2012, Samejima&#160;<em>et al</em>. in&#160;prep.). But in 2012, two animals were killed in the Serian district, southwest Sarawak (Samejima&#160;<em>et al</em>. in&#160;prep.). In Kalimantan this species seems to have been recorded&#160;recently&#160;only in north and east Kalimantan (e.g., Rustam and Giordano 2014), but it was also at least locally common in south, central and west Kalimantan in the beginning of the 20th century (e.g., Lyon 1911). In west Kalimantan a specimen was collected at the Melawi river near Sintang (Medway 1977) and the recently interviewed local people from this area were familiar with this species (Samejima&#160;<em>et al</em>. in&#160;prep.).&#160;In Java all known recent records are from west Java, but van Balen (1914) recorded it from the Dieng Plateau in central Java and there are further records from Mt Ardjuna and the Tenger Mountains in east Java (Horsfield 1824, Hassan 1892). In west Java it seems to be common in the remaining forests, with recent records from various sites including Gunung Gede Pangrango National Park, Gunung Halimun Salak NP, Gunung Ciremai NP and Gunung Malabar Protected Forest (A. Ario pers. comm. 2014) at elevations from the lowlands up to 2,000 m asl; its status in non-forest areas is unclear.&#160;In Sumatra it has recently been recorded in Bukit Barisan Selatan National Park between 600 and 1,100 m asl (J. McCarthy pers. comm. 2014) in the south of the island, up to Aceh (between 870 and 1,740 m asl) in the north (M. Linkie pers. comm. 2014). Further recent records come from Kerinci Seblat NP (Holden 2006, M. Linkie pers. comm. 2014) and the Bukit Tigapuluh Landscape (P.H. Pratje and A.M. Moßbrucker pers. comm. 2014).","On Java, the anal gland secretion is used to make perfume (Long and Killingley 1983). Some rural people eat the flesh of this species (Rustam and Giordano 2014). Banks (1931) noted that the local people mix the shavings of the skin with water and drink them as a cure for fever or rheumatism.",Terrestrial,"Sunda Stink-badger&#160;has been recorded in various protected areas in Borneo (particularly the northern half), Sumatra and Java, and is likely to occur in many more. It is not protected in Sarawak, but it is protected in Sabah (Wildlife Conservation Enactment 1998) and in Indonesia (PP RI No. 7, 1999).With no threats identified or suggested, a continued wide distribution and high frequency of records, there are no obvious conservation needs for this species. Continued coarse monitoring of its status might be useful.",Indomalayan,,false,false,Global
